<?xml version="1.0" encoding="UTF-8"?>
<xs:schema xmlns:xs="http://www.w3.org/2001/XMLSchema" xmlns="http://www.w3schools.com/myns/" targetNamespace="http://www.w3schools.com/myns/" elementFormDefault="qualified">
	<xs:element name="employmentRecord">
		<xs:complexType>
			<xs:sequence>
				<xs:element name="personnummer">
					<xs:simpleType>
						<xs:restriction base="xs:string">
							<xs:pattern value="\d{6}-\d{4}"/>
						</xs:restriction>
					</xs:simpleType>
				</xs:element>
				<xs:element name="employment" minOccurs="1" maxOccurs="unbounded">
					<xs:complexType>
						<xs:sequence>
							<xs:element name="code">
								<xs:simpleType>
									<xs:restriction base="xs:string">
										<xs:pattern value="\d{4}"/>
									</xs:restriction>
								</xs:simpleType>
							</xs:element>
							<xs:element name="from">
								<xs:simpleType>
									<xs:restriction base="xs:date">
										<xs:pattern value="\d{2}-\d{2}-\d{4}"/>
									</xs:restriction>
								</xs:simpleType>
							</xs:element>
							<xs:element name="to">
								<xs:simpleType>
									<xs:restriction base="xs:date">
										<xs:pattern value="\d{2}-\d{2}-\d{4}"/>
									</xs:restriction>
								</xs:simpleType>
							</xs:element>
						</xs:sequence>
					</xs:complexType>
				</xs:element>
			</xs:sequence>
		</xs:complexType>
	</xs:element>
</xs:schema>
