<?xml version="1.0" encoding="UTF-8"?>
<employmentRecord xmlns:xsi='http://www.w3.org/2001/XMLSchema-instance'
                   xmlns='http://www.w3schools.com/myns/'
                   xsi:schemaLocation='http://www.w3schools.com/myns/ file://schemas/EmploymentRecord.xsd'>
    <personnummer>880513-1234</personnummer>
    <employment>
        <code>5000</code>
        <from>2014-09-19</from>
        <to>2015-09-19</to>
    </employment>
    <employment>
        <code>5001</code>
        <from>2015-09-20</from>
        <to>2016-09-19</to>
    </employment>
    <employment>
        <code>5002</code>
        <from>2016-09-20</from>
        <to>2017-09-19</to>
    </employment>
</employmentRecord>